<?xml version= "1.0" encoding= "UTF-8"?>

<JJOO identificador="Tokio 2020" xmlns:xsi="http://www.w3.org/2001/XMLSchema-instance" xsi:noNamespaceSchemaLocation="JJOO.xsd">

    <edicio>32</edicio>
    <localitzacio pais="Tokio, Japon"/>
    <web url="https://olympics.com/es/olympic-games/tokyo-2020"/>

    <num_participants>
        <countries>205</countries>
        <athletes>11420</athletes>
    </num_participants>
    
    <interest_dates>
        <open_date>27/07/2020</open_date>
        <close_date>08/08/2020</close_date>
    </interest_dates>

    <seusOnEsDisputenLesCompeticion>

        <seu nom="Seu de ceremonia d'apertura" ciutat="Tokio Japón" edifici="Estadio Olímpico de Tokio" funcionalitat="Ceremonia apertura Jocs Olimpics"/>
        <seu nom="Seu de ceremonia clausura" ciutat="Tokio Japón" edifici="Estadio Olímpico de Tokio" funcionalitat="Ceremonia clausura Jocs Olimpics"/>
        <seu nom="Seu de COI" ciutat="Suiza Lausana" edifici="sede central del Comité Olímpico Internacional" funcionalitat="Coordinar las actividades del Movimiento Olímpico"/>
        <seu nom="Villa Olimpica" ciutat="Tokio Chuo Ward" edifici="Chuo Ward" funcionalitat="Acollir a atletes y personal dels jocs Olimpics"/>
        <seu nom="Centres de medis" ciutat="Tokio Chuo Ward" edifici="Tokio Big Sight" funcionalitat="Administrar els medis de comunicacio"/>
        <seu nom="Centre internacional de prensa" ciutat="Tokio Chuo Ward" edifici="Tokio Big Sight" funcionalitat="Administrar a la prensa"/>

    </seusOnEsDisputenLesCompeticion>

    <!-- Seus on es van disputar les competicions -->
    <sedesDondeSeDisputaronLasCompeticiones>

        <!--Seu de l'Esport 1. Basquet-->
        <seu esportDisputat="Basquet">

            <nomSeu nom="Saitama Super Arena"/>
            <ciutatSeu ciutat="Chūō-ku, Saitama"/>
            <capacitatSeu capacitat="19000 - 22500"/>
            
            <!-- Esports Acollits dins de la seu -->
            <esportsAcollits esportsAcollitsALaSeu="Boxeo, basquet, volley, tenis, hockey sobre hielo, gimnasia">

                <!-- Esport 1 acollit a la seu - Basquet -->
                <esport nom="Basquet 5x5" anyPrimerCopEsportOlimpic="1904" dataInici="25/07/2020" dataFinalizacio="08/09/2020">
                    
                    <!-- Categoria Numero 1 -->
                    <categoriaEsport nom="5x5" sexe="masculi, femeni">

                        <medalles>
                            <!-- Medalla de Or -->
                            <Categoria tipusMedalla="or" diaGuanyada="07/08/2020" horaDeComencament="03:30" dinsDeLaSeuLlocDeDisputa="Saitama Super Arena">
                                <paisGuanyador pais="Estados Unidos"/>
                                <atletaGuanyador atleta="Estados Unidos"/>
                            </Categoria>
                            <!-- Medalla de Plata -->
                            <Categoria tipusMedalla="plata" diaGuanyada="07/08/2020" horaDeComencament="03:30" dinsDeLaSeuLlocDeDisputa="Saitama Super Arena">
                                <paisGuanyador pais="Francia"/>
                                <atletaGuanyador atleta="Estados Unidos"/>
                            </Categoria>
                            <!-- Medalla de Bronze -->
                            <Categoria tipusMedalla="bronze" diaGuanyada="07/08/2020" horaDeComencament="03:30" dinsDeLaSeuLlocDeDisputa="Saitama Super Arena">
                                <paisGuanyador pais="Australia"/>
                                <atletaGuanyador atleta="Estados Unidos"/>

                            </Categoria>

                        </medalles>

                    </categoriaEsport>

                    <!-- Categoria Numero 2 -->
                    <categoriaEsport nom="Basquet 3x3" sexe="masculi, femeni">

                        <medalles>
                            <!-- Medalla de Or -->
                            <Categoria tipusMedalla="or" diaGuanyada="07/07/2020" horaDeComencament="15:25" dinsDeLaSeuLlocDeDisputa="Saitama Super Arena">
                                <paisGuanyador pais="Letonia"/>
                                <atletaGuanyador atleta="Letonia"/>
                            </Categoria>
                            <!-- Medalla de Plata -->
                            <Categoria tipusMedalla="plata" diaGuanyada="07/07/2020" horaDeComencament="15:25" dinsDeLaSeuLlocDeDisputa="Saitama Super Arena">
                                <paisGuanyador pais="ROC"/>
                                <atletaGuanyador atleta="ROC"/>
                            </Categoria>
                            <!-- Medalla de Bronze -->
                            <Categoria tipusMedalla="bronze" diaGuanyada="07/07/2020" horaDeComencament="15:25" dinsDeLaSeuLlocDeDisputa="Saitama Super Arena">
                                <paisGuanyador pais="Serbia"/>
                                <atletaGuanyador atleta="Serbia"/>
                            </Categoria>

                        </medalles>
                    </categoriaEsport>
                </esport>
            </esportsAcollits>
        </seu>

        <!--Seu de l'Esport 2. SkateBoarding-->
        <seu esportDisputat="SkateBoarding">

            <nomSeu nom="Parque Deportivo Urbano de Ariake"/>
            <ciutatSeu ciutat="Ariake"/>
            <capacitatSeu capacitat="6000 - 7000"/>
            
            <!-- Esports Acollits dins de la seu -->
            <esportsAcollits esportsAcollitsALaSeu="skateboarding y ciclismo olimpico">

                <!-- Esport 1 acollit a la seu - Basquet -->
                <esport nom="SkateBoarding" anyPrimerCopEsportOlimpic="1994" dataInici="24/07/2020" dataFinalizacio="25/07/2020">
                    
                    <!-- Categoria Numero 1 -->
                    <categoriaEsport nom="Carrer" sexe="masculi, femeni">

                        <medalles>
                            <!-- Medalla de Or -->
                            <Categoria tipusMedalla="or" diaGuanyada="25/07/2020" horaDeComencament="02:00" dinsDeLaSeuLlocDeDisputa="Skatepark">
                                <paisGuanyador pais="Japon"/>
                                <atletaGuanyador atleta="Yuto Horigome"/>
                            </Categoria>
                            <!-- Medalla de Plata -->
                            <Categoria tipusMedalla="plata" diaGuanyada="25/07/2020" horaDeComencament="02:00" dinsDeLaSeuLlocDeDisputa="Skatepark">
                                <paisGuanyador pais="Brazil"/>
                                <atletaGuanyador atleta=" Kelvin Hoefler"/>
                            </Categoria>
                            <!-- Medalla de Bronze -->
                            <Categoria tipusMedalla="bronze" diaGuanyada="25/07/2020" horaDeComencament="02:00" dinsDeLaSeuLlocDeDisputa="Skatepark">
                                <paisGuanyador pais="Estados Unidos"/>
                                <atletaGuanyador atleta="Jagger Eaton"/>
                            </Categoria>
                        </medalles>

                    </categoriaEsport>

                    <!-- Categoria Numero 2 -->
                    <categoriaEsport nom="Parc" sexe="masculi, femeni">

                        <medalles>
                            <!-- Medalla de Or -->
                            <Categoria tipusMedalla="or" diaGuanyada="05/08/2020" horaDeComencament="02:00" dinsDeLaSeuLlocDeDisputa="Skatepark">
                                <paisGuanyador pais="Australia"/>
                                <atletaGuanyador atleta="Keegan Palmer"/>
                            </Categoria>
                            <!-- Medalla de Plata -->
                            <Categoria tipusMedalla="plata" diaGuanyada="05/08/2020" horaDeComencament="02:00" dinsDeLaSeuLlocDeDisputa="Skatepark">
                                <paisGuanyador pais="Brazil"/>
                                <atletaGuanyador atleta="Pedro Barros"/>
                            </Categoria>
                            <!-- Medalla de Bronze -->
                            <Categoria tipusMedalla="bronze" diaGuanyada="05/08/2020" horaDeComencament="02:00" dinsDeLaSeuLlocDeDisputa="Skatepark">
                                <paisGuanyador pais="Estados Unidos"/>
                                <atletaGuanyador atleta="Cory Juneau"/>
                            </Categoria>

                        </medalles>
                    </categoriaEsport>
                </esport>
            </esportsAcollits>
        </seu>

        <!--Seu de l'Esport 3. Tenis de Taula-->
        <seu esportDisputat="Ciclisme Olimpic">

            <nomSeu nom="Parque Deportivo Urbano de Ariake"/>
            <ciutatSeu ciutat="Ariake"/>
            <capacitatSeu capacitat="5000 - 6000"/>
            
            <!-- Esports Acollits dins de la seu -->
            <esportsAcollits esportsAcollitsALaSeu="skateboarding y ciclismo olimpico">

                <!-- Esport 1 acollit a la seu - Basquet -->
                <esport nom="Ciclisme" anyPrimerCopEsportOlimpic="1896"  dataInici="25/06/2020" dataFinalizacio="05/08/2020">
                    
                    <!-- Categoria Numero .1 - de BMX Freestyle-->
                    <categoriaEsport nom="BMX Freestyle" sexe="masculi, femeni">

                        <!-- Medalles -->
                        <medalles>
                            <!-- Medalla de Or -->
                            <Categoria tipusMedalla="or" diaGuanyada="01/08/2020" horaDeComencament="03:10" dinsDeLaSeuLlocDeDisputa="La Pista">
                                <paisGuanyador pais="Australia"/>
                                <atletaGuanyador atleta="Logan Martin"/>
                            </Categoria>